[
  {
    "schema_version": "1.0.0",
    "id": "morning_001",
    "source": "compiled_internal",
    "license": "unspecified",
    "category": "Morning",
    "occasion": "Morning remembrance",
    "tags": [
      "morning",
      "morning_remembrance"
    ],
    "arabic": "اللَّهُمَّ بِكَ أَصْبَحْنَا وَبِكَ أَمْسَيْنَا وَبِكَ نَحْيَا وَبِكَ نَمُوتُ وَإِلَيْكَ النُّشُورُ",
    "transliteration": "Allāhumma bika aṣbaḥnā wa bika amsaynā wa bika naḥyā wa bika namūtu wa ilayka n-nushūr",
    "translation_en": "O Allah, by You we enter the morning and by You we enter the evening, by You we live and by You we die, and unto You is the resurrection.",
    "length": "medium",
    "word_count_arabic": 11,
    "repetitions": 1,
    "priority": 1,
    "display_context": {
      "time_windows": [
        "morning"
      ],
      "hijri_dates": [],
      "hijri_periods": [],
      "conditions": [
        "morning_remembrance"
      ],
      "days_of_week": []
    },
    "authenticity": {
      "grade": "unknown",
      "origin": "unknown"
    },
    "benefits": "Morning remembrance",
    "notes": "",
    "related_ids": [],
    "variants": [],
    "frequency": "daily"
  },
  {
    "schema_version": "1.0.0",
    "id": "morning_002",
    "source": "compiled_internal",
    "license": "unspecified",
    "category": "Morning",
    "occasion": "Morning remembrance",
    "tags": [
      "morning",
      "morning_remembrance"
    ],
    "arabic": "أَصْبَحْنَا وَأَصْبَحَ الْمُلْكُ لِلَّهِ",
    "transliteration": "Aṣbaḥnā wa aṣbaḥa l-mulku lillāh",
    "translation_en": "We have entered a new day and the kingdom belongs to Allah.",
    "length": "short",
    "word_count_arabic": 4,
    "repetitions": 1,
    "priority": 2,
    "display_context": {
      "time_windows": [
        "morning"
      ],
      "hijri_dates": [],
      "hijri_periods": [],
      "conditions": [
        "morning_remembrance"
      ],
      "days_of_week": []
    },
    "authenticity": {
      "grade": "unknown",
      "origin": "unknown"
    },
    "benefits": "Morning remembrance",
    "notes": "",
    "related_ids": [],
    "variants": [],
    "frequency": "daily"
  },
  {
    "schema_version": "1.0.0",
    "id": "evening_001",
    "source": "compiled_internal",
    "license": "unspecified",
    "category": "Evening",
    "occasion": "Evening remembrance",
    "tags": [
      "evening",
      "evening_remembrance"
    ],
    "arabic": "اللَّهُمَّ بِكَ أَمْسَيْنَا وَبِكَ أَصْبَحْنَا وَبِكَ نَحْيَا وَبِكَ نَمُوتُ وَإِلَيْكَ الْمَصِيرُ",
    "transliteration": "Allāhumma bika amsaynā wa bika aṣbaḥnā wa bika naḥyā wa bika namūtu wa ilayka l-maṣīr",
    "translation_en": "O Allah, by You we enter the evening and by You we enter the morning, by You we live and by You we die, and unto You is the return.",
    "length": "medium",
    "word_count_arabic": 11,
    "repetitions": 1,
    "priority": 1,
    "display_context": {
      "time_windows": [
        "evening"
      ],
      "hijri_dates": [],
      "hijri_periods": [],
      "conditions": [
        "evening_remembrance"
      ],
      "days_of_week": []
    },
    "authenticity": {
      "grade": "unknown",
      "origin": "unknown"
    },
    "benefits": "Evening remembrance",
    "notes": "",
    "related_ids": [],
    "variants": [],
    "frequency": "daily"
  },
  {
    "schema_version": "1.0.0",
    "id": "before_eating_001",
    "source": "compiled_internal",
    "license": "unspecified",
    "category": "Before Eating",
    "occasion": "Before meals",
    "tags": [
      "before_eating",
      "before_meals"
    ],
    "arabic": "بِسْمِ اللهِ",
    "transliteration": "Bismillāh",
    "translation_en": "In the name of Allah",
    "length": "short",
    "word_count_arabic": 2,
    "repetitions": 1,
    "priority": 1,
    "display_context": {
      "time_windows": [
        "anytime"
      ],
      "hijri_dates": [],
      "hijri_periods": [],
      "conditions": [
        "before_meals"
      ],
      "days_of_week": []
    },
    "authenticity": {
      "grade": "unknown",
      "origin": "unknown"
    },
    "benefits": "Before meals",
    "notes": "",
    "related_ids": [],
    "variants": []
  },
  {
    "schema_version": "1.0.0",
    "id": "after_eating_001",
    "source": "compiled_internal",
    "license": "unspecified",
    "category": "After Eating",
    "occasion": "After meals",
    "tags": [
      "after_eating",
      "after_meals"
    ],
    "arabic": "الْحَمْدُ لِلَّهِ الَّذِي أَطْعَمَنَا وَسَقَانَا وَجَعَلَنَا مُسْلِمِينَ",
    "transliteration": "Alḥamdu lillāhi lladhī aṭʿamanā wa saqānā wa jaʿalanā muslimīn",
    "translation_en": "Praise be to Allah who has fed us and given us drink and made us Muslims",
    "length": "short",
    "word_count_arabic": 7,
    "repetitions": 1,
    "priority": 1,
    "display_context": {
      "time_windows": [
        "anytime"
      ],
      "hijri_dates": [],
      "hijri_periods": [],
      "conditions": [
        "after_meals"
      ],
      "days_of_week": []
    },
    "authenticity": {
      "grade": "unknown",
      "origin": "unknown"
    },
    "benefits": "After meals",
    "notes": "",
    "related_ids": [],
    "variants": []
  },
  {
    "schema_version": "1.0.0",
    "id": "entering_home_001",
    "source": "compiled_internal",
    "license": "unspecified",
    "category": "Entering Home",
    "occasion": "Entering home",
    "tags": [
      "entering_home"
    ],
    "arabic": "اللَّهُمَّ إِنِّي أَسْأَلُكَ خَيْرَ الْمَوْلَجِ وَخَيْرَ الْمَخْرَجِ",
    "transliteration": "Allāhumma innī asʾaluka khayra l-mawlaji wa khayra l-makhraji",
    "translation_en": "O Allah, I ask You for the best entering and the best exiting",
    "length": "short",
    "word_count_arabic": 7,
    "repetitions": 1,
    "priority": 1,
    "display_context": {
      "time_windows": [
        "anytime"
      ],
      "hijri_dates": [],
      "hijri_periods": [],
      "conditions": [
        "entering_home"
      ],
      "days_of_week": []
    },
    "authenticity": {
      "grade": "unknown",
      "origin": "unknown"
    },
    "benefits": "Entering home",
    "notes": "",
    "related_ids": [],
    "variants": []
  },
  {
    "schema_version": "1.0.0",
    "id": "leaving_home_001",
    "source": "compiled_internal",
    "license": "unspecified",
    "category": "Leaving Home",
    "occasion": "Leaving home",
    "tags": [
      "leaving_home"
    ],
    "arabic": "بِسْمِ اللَّهِ تَوَكَّلْتُ عَلَى اللَّهِ وَلَا حَوْلَ وَلَا قُوَّةَ إِلَّا بِاللَّهِ",
    "transliteration": "Bismillāh tawakkaltu ʿalá llāh wa lā ḥawla wa lā quwwata illā billāh",
    "translation_en": "In the name of Allah, I place my trust in Allah, there is no might nor power except with Allah",
    "length": "medium",
    "word_count_arabic": 11,
    "repetitions": 1,
    "priority": 1,
    "display_context": {
      "time_windows": [
        "anytime"
      ],
      "hijri_dates": [],
      "hijri_periods": [],
      "conditions": [
        "leaving_home"
      ],
      "days_of_week": []
    },
    "authenticity": {
      "grade": "unknown",
      "origin": "unknown"
    },
    "benefits": "Leaving home",
    "notes": "",
    "related_ids": [],
    "variants": []
  },
  {
    "schema_version": "1.0.0",
    "id": "before_sleep_001",
    "source": "compiled_internal",
    "license": "unspecified",
    "category": "Before Sleep",
    "occasion": "Before sleep",
    "tags": [
      "before_sleep"
    ],
    "arabic": "بِاسْمِكَ اللَّهُمَّ أَمُوتُ وَأَحْيَا",
    "transliteration": "Bismika llāhumma amūtu wa aḥyā",
    "translation_en": "In Your name O Allah, I die and I live",
    "length": "short",
    "word_count_arabic": 4,
    "repetitions": 1,
    "priority": 1,
    "display_context": {
      "time_windows": [
        "night"
      ],
      "hijri_dates": [],
      "hijri_periods": [],
      "conditions": [
        "before_sleep"
      ],
      "days_of_week": []
    },
    "authenticity": {
      "grade": "unknown",
      "origin": "unknown"
    },
    "benefits": "Before sleep",
    "notes": "",
    "related_ids": [],
    "variants": []
  },
  {
    "schema_version": "1.0.0",
    "id": "waking_up_001",
    "source": "compiled_internal",
    "license": "unspecified",
    "category": "Waking Up",
    "occasion": "Upon waking",
    "tags": [
      "waking_up",
      "upon_waking"
    ],
    "arabic": "الْحَمْدُ لِلَّهِ الَّذِي أَحْيَانَا بَعْدَ مَا أَمَاتَنَا وَإِلَيْهِ النُّشُورُ",
    "transliteration": "Alḥamdu lillāhi lladhī aḥyānā baʿda mā amātanā wa ilayhi n-nushūr",
    "translation_en": "Praise is to Allah who gave us life after death and unto Him is the resurrection",
    "length": "short",
    "word_count_arabic": 9,
    "repetitions": 1,
    "priority": 1,
    "display_context": {
      "time_windows": [
        "morning"
      ],
      "hijri_dates": [],
      "hijri_periods": [],
      "conditions": [
        "upon_waking"
      ],
      "days_of_week": []
    },
    "authenticity": {
      "grade": "unknown",
      "origin": "unknown"
    },
    "benefits": "Upon waking",
    "notes": "",
    "related_ids": [],
    "variants": []
  },
  {
    "schema_version": "1.0.0",
    "id": "travel_001",
    "source": "compiled_internal",
    "license": "unspecified",
    "category": "Travel",
    "occasion": "Starting a journey",
    "tags": [
      "travel",
      "starting_a_journey"
    ],
    "arabic": "سُبْحَانَ الَّذِي سَخَّرَ لَنَا هَذَا وَمَا كُنَّا لَهُ مُقْرِنِينَ وَإِنَّا إِلَى رَبِّنَا لَمُنْقَلِبُونَ",
    "transliteration": "Subḥāna lladhī sakhkhara lanā hādhā wa mā kunnā lahu muqrinīn wa innā ilā rabbinā la-munqalibūn",
    "translation_en": "Glory to Him who has subjected this to us, and we could never have it by our efforts. Surely, unto our Lord we are returning.",
    "length": "medium",
    "word_count_arabic": 13,
    "repetitions": 1,
    "priority": 1,
    "display_context": {
      "time_windows": [
        "anytime"
      ],
      "hijri_dates": [],